ID,label,has curation status,alternative term,definition,definition source,example of usage,editor note,term editor,ontology term requester,term tracker item,logical type,logical note,parent class,material processing technique,detection technique,evaluant,analyte,device,reagent,molecular label,input,output,target entity,objective,associated axioms
OBI:0001980,in vivo intervention experiment,,,An assay in which the effect of a targeted process (the intervention) on an organism is tested.,IEDB,Comparing the level of allergy symptoms in humans before and post allergy immunotherapy. Testing if injection of a chemical compound into mice will lead to decreased survival.,"The intervention in an experiment should be modeled accordingly to the intevention carried out in a human cllinical trial, which is currently modeled as 'study intervention'. This touches the boundaries of study vs. assay.",IEDB,,,subclass,logical definition does not capture intervention,assay,,,organism,,,,,,,,,
OBI:0001981,disease exacerbation in vivo intervention experiment,,,An in vivo intervention experiment that tests the ability of the intervention to increase the severity of a disease in the host.,IEDB,Injecting a set of mice with a peptide and measuring symtoms to determine if their disease course was more severe than the disease course of a set of mice that were not injected with the same peptide.,Should have data about disease severity as readout; could just use disease for now,IEDB,,,subclass,logical definition does not capture disease exacerbation,in vivo intervention experiment,,,,,,,,,,,,
OBI:0001982,protection from challenge in vivo intervention experiment,,,An in vivo intervention experiment that tests the ability of the intervention to prevent occurrence of a disease in a host.,IEDB,Injecting a set of mice with a peptide and measuring symtoms to determine if their disease course was less severe than the disease course of a set of mice that were not injected with the same peptide. ,should have challenge as intervention ,IEDB,,,subclass,logical definition does not capture challenge,in vivo intervention experiment,,,,,,,,,,,,
OBI:0001983,tolerance induction intervention experiment,,,An in vivo intervention experiment that tests the ability of the intervention to decrease an immune response.,IEDB,Injecting a set of mice with a Der p 2 peptide and measuring the IL-2 response of T cells from those mice when exposed to the Der p 2 protein in vitro to determine if those T cells made less IL-2 than cells taken from mice which were not injected with the same Der p 2 peptide.,should have tolerance induction as intervention,IEDB,,,subclass,logical definition does not capture tolerance induction,in vivo intervention experiment,,,,,,,,,,,,
OBI:0001984,treatment intervention experiment,,,An in vivo intervention experiment in which the ability of the intervention to reduce or cure the effects of a disease are tested.,IEDB,Testing if administering oral histamine-blockers will reduce the number of emergency room visits in severely asthmatic individuals.,should have treatment as intervention,IEDB,,,subclass,logical definition does not capture treatment,in vivo intervention experiment,,,,,,,,,,,,
OBI:0001985,microarray assay,,,An analyte assay where binding of the analyte to immobilized matrix is measured.,IEDB,Measuring if sera from an influenza A virus immunizedmouse binds to Hemagglutinin protein that is immobilized on a microarray.,,IEDB,,,equivalent,,analyte assay,,,,,microarray,,,,,,,
OBI:0001986,immunohistochemistry,,,An immunostaining assay to detect and potentially localize antigens within the cells of a tissue section.,IEDB,Staining a brain tissue sample from an Alzheimer's disease patient with antibodies to amyloid beta to identify amyloid plaques.,,IEDB,,,equivalent,,immuno staining assay,,,specimen from organism,,,,material entity,,,,,
OBI:0002106,carboxyfluorescein succinimidyl ester staining assay,,CFSE assay,a detection of molecular label assay where the amount of carboxyfluorescein succinimidyl ester is measured using fluorescence detection.,IEDB,Measuring T cell proliferation based on the progressive halving of CFSE fluorescence within daughter cells following each cell division.,,IEDB,,,subclass,logical definition does not capture daughter cells,detection of molecular label,,fluorescence detection assay,,,,,,,,,,
OBI:0002107,bio-layer interferometry assay,,"biolayer interferometry, BLI",A binding assay that detects a shift in the interference pattern reflected from a layer of immobilized material on the biosensor tip to measure binding to- or dissociating from the material on the biosensor.,IEDB,Detecting the presence of an antibody in a cell culture supernatant by detecting a shift in the interference pattern reflected from a layer of immobilized protein to which the antibody binds.,,IEDB,,,subclass,logical definition does not capture shift in patter,binding assay,,,,,,,,,,,,
OBI:0002108,small-angle scattering assay,,SAXS,"A 3D structure determination assay in which the scattering pattern of a neutron or x-ray beam targeted at a material entity is recorded at small angles relative to the incident beam to determine the size, shape and structure of the material entity examined. ",IEDB,Targeting a solution of antibody bound to a protein with a neutron beam to determine the binding site of the antibody on the protein,,IEDB,,,subclass,logical definition does not capture neutrino beam,3D structure determination assay,,,,,,,,,,,,
OBI:0002115,cytometry time of flight assay,,CyTOF,A cytometry assay in which the presence of molecules of interest on or in cells is indicated by binding of antibodies labeled with rare earth element tags which are detected by time-of-flight mass spectrometry.,http://www.ncbi.nlm.nih.gov/pubmed/26190063,"Whole human blood samples were incubated with lipopolysaccharide (LPS) to examine dose-dependent signaling responses within the toll-like receptor 4 (TLR4) pathway. After LPS stimulation, rare earth metal tagged antibodies against phenotypic markers were used to stain the blood sample (Nd143-CD45RA, Nd145-CD4, Er170-CD3, Sm152-TCR__, Pr141-CD7, Nd146-CD8, Nd142-CD19). A Fluidigm CyTOF version 1 instrument equipped with CyTOF software version 5.1.648 was used to measure and analyze the levels of antibody staining refelctive of the level of expression of those surface receptors.",,ImmPort,,,subclass,"logical definition does not capture ""time of flight"" part",cytometry assay,,mass spectrometry assay,,,,,rare earth metal atom,,,,,
OBI:0002116,high performance liquid chromotography assay,,HPLC,An analytical chromatography assay that utilizes a high performance liquid chromatography instrument for separation of compounts in a solution.,http://www.ncbi.nlm.nih.gov/pubmed/9491555,"On-line coupled immunoaffinity chromatography-reversed-phase high-performance liquid chromatography (IAC-HPLC) with detection by quadrupole ion trap mass spectrometry using a particle beam interface has been developed for the determination of the steroids, dexamethasone and flumethasone. HEMA (polyhydroxyethylmethacrylate) was evaluated as a support material for the anti-dexamethasone antibodies used in IAC. Antibody cross-reactivity and non-specific binding have been investigated for the HEMA bound anti-dexamethasone IAC column. The on-line IAC-HPLC-MS determination of dexamethasone and flumethasone in post-administration equine urine samples showed precisions (R.S.D.) of 8.0 and 7.1%, respectively, with limits of detection in the range 3-4 ng/ml.",,ImmPort,,,equivalent,,analytical chromatography,,,,,high performance liquid chromatography instrument,,,,,,,
OBI:0002117,whole genome sequencing assay,,WGS,A DNA sequencing assay that intends to provide information about the sequence of an entire genome of an organism.,"http://www.ncbi.nlm.nih.gov/pubmed/25827230, http://www.ncbi.nlm.nih.gov/pubmed/23095910","WGS permits comprehensive sequencing of introns and exons, whereas whole exome sequencing (WES) allows deeper sequencing of exonic regions at a lower cost. Due to the large number of genetic variants found in each genome, it is necessary to use filtering approaches to distinguish deleterious from benign variants. WES has been used successfully to identify novel genetic causes of primary immunodeficiency. Complex structural variations and non-Mendelian disorders remain challenges for WGS.",Genotyping assays should ideally identify which part of the genome the information is about. We do not currently have a good way to do this. That information should be added later.,ImmPort,,,subclass,logical definition does not capture what the output is about,DNA sequencing,,,,,,,,,,,,
OBI:0002118,exome sequencing assay,,WES,A DNA sequencing assay that intends to provide information about the sequence of the protein coding components of a genome (exons).,http://www.ncbi.nlm.nih.gov/pubmed/25827230,"DNA was extracted from the Ficoll pellet of blood taken from congenital asplenia patients. Unamplified, high-molecular weight, RNase-treated genomic DNA (4_6 _g) was used for whole exome sequencing (WES) with the use of Agilent 71 Mb (V4 + UTR) singlesample capture and an Illumina HiSeq 2000. Sequencing was carried out so as to obtain 30_ coverage from 2 _ 100-bp paired-end reads. We used the Annovar tool (25) to annotate the resulting highquality (HQ) variants. In the regions targeted by WES capture (81.5% of the consensus coding genome), the mean numbers of single-nucleotide variants (SNVs) and small insertions/deletions (indels) detected per sample were 84,192 and13,325, respectively. After filtering, a mean of 74,398 (95.3%) high-quality (HQ) SNVs and 9,033 (70.6%) HQ indels were called. A mean of 105 coding HQ SNVs and 32 indels was identified.",,ImmPort,,,subclass,logical definition does not capture exons,DNA sequencing,,,,,,,,,,,,
OBI:0002119,microscopy assay,,,An imaging assay that utilizes a microscope to magnify features of the visualized material of interest that are not visible to naked eye.,http://www.ncbi.nlm.nih.gov/pubmed/21685355,"Lung, liver, and spleen tissue samples were collected from female BALB/c mice and fixed in 100% formalin solution, embedded in paraffin, sectioned, and stained with hematoxylin and eosin. The stained samples were examined for signs of pathological changes under light microscopy.",,ImmPort,,,equivalent,,imaging assay,,,,,microscope,,,,,,,
OBI:0002120,mixed lymphocyte reaction assay,,MLR,"A cytometry assay where lymphocytes from two individuals are co-cultured with the lymphocytes from one of the allogeneic individuals (Responders) being labeled (with 3H Thymidine or BrdU) and the proliferation of the labeled cells is measured, which is thought to reflect recognition of histocompatibility antigens on the unlabeled cells (stimulators).",http://www.ncbi.nlm.nih.gov/pubmed/14969764,"T cells were separated from PBL of laboratory volunteers and used as responder cells (R). Mitomycin C-treated allogeneic mAPC enriched populations were used as stimulators (S), incubated for 5 days, pulsed with 3H-thymidine (3H-TdR) for 16 hours, harvested, and radioactivity counted using a beta scintillation counter to measure proliferation of the 3H-thymidine labeled cells.",,ImmPort,,,subclass,logical definition does not capture culturing,cytometry assay,,,,,,molecular label,,,,,,
OBI:0002121,killer cell immunoglobulin-like receptor typing assay,,KIR typing,A genotyping assay in which the alleles of genes encoding for killer cell immunoglobulin-like receptors are determined.,http://www.ncbi.nlm.nih.gov/pubmed/21239231,"DNA was isolated from PBMCs from healthy donors.The single-nucleotide polymorphism (SNP) assay was performed on an HT7900 Sequence Detection System (Applied Biosystems) following the allelic discrimination assay protocol provided by the manufacturer. Primers for the assay were designed in such a way that they amplified all the alleles of a particular HLA type (HLA-B or HLA-C) as well as the amplicon containing the polymorphic region of interest. Two probes were designed with a single mismatch between them. Each probe bound only one group of alleles and was labeled with either 6FAM or VIC fluorescent dye at its 5_ end. The 3_ end of the probes contained a quencher. For KIR2DL1 functional allele typing, the probe was designed based on a single-nucleotide mismatch at amino acid position 245 in the mature protein. A universal primer was designed that could specifically amplify all the alleles of KIR2DL1.The SNP assay was run on the HT7900 using the same protocol as described for KIR ligand typing. Results showed that 20 individuals had only arginine at amino acid position 245 of KIR2DL1, 5 were heterozygous for arginine and cysteine, and 1 had only cysteine in that position.Thus, this approach was useful not only for the identification of functional groups of KIR alleles, but also for determining the presence of the KIR gene itself.",Genotyping assays should ideally identify which part of the genome the information is about. We do not currently have a good way to do this. That information should be added later.,ImmPort,,,subclass,logical definition does not capture what part of the genome the output is about,genotyping assay,,,,,,,,,,,,
OBI:0002122,major histocompatibility typing assay,,"MHC typing, HLA typing",A genotyping assay in which the alleles of genes encoding for major histocompatibility complex molecules are determined.,"http://www.ncbi.nlm.nih.gov/pubmed/27516207, http://www.ncbi.nlm.nih.gov/pmc/articles/PMC2628004/","Blood samples from Holstein-Friesian heifer calves were used to isolate white blood cell (WBC) pellets, from which total RNA was extracted using Tri-reagent and cDNA generated using a Reverse Transcription Kit, both  according to the manufacturers? instructions. An alignment of sequences of known bovine MHCI gene cDNAs, as presented in the IPD-MHC database (May 2014), was used to design a series of 3_ (for) and 5_ (rev) pan-MHCI primers. cDNA from individual animals was subject to PCR amplification in two separate reactions using either the For1/Rev2 or the For3/Rev1 primer pairs. For each sample primers using a unique combination of MID tags were used to allow subsequent de-multiplexing of the sequence data. PCRs were conducted using the Phusion High-Fidelity PCR kit. Following amplification, 5?_l of PCR products from each sample were pooled, purified using Agencourt AMPure XP Beads and run on a 1.5?% agarose gel. Bands of the appropriate size  were extracted and purified using the Qiagen Gel extraction kit. Libraries were submitted to Edinburgh Genomics where after standard quality control procedures they underwent 300 base paired-end sequencing on an Illumina MiSeq v3. Data were separated into reads generated from For1Rev2 and For3Rev1 primer pairs, generating separate datasets for up to 192 samples. Within each sample, reads were clustered into unique variants which were subsequently compared using BLAST against a database of the previously identified bovine MHCI sequences. This process identified >140 novel classical MHCI genes and defined 62 novel MHCI haplotypes, dramatically expanding the known bovine MHCI repertoire.",Genotyping assays should ideally identify which part of the genome the information is about. We do not currently have a good way to do this. That information should be added later.,IEDB,,,subclass,logical definition does not capture what part of the genome the output is about,genotyping assay,,,,,,,,,,,,
OBI:0002145,antigen specific antibodies assay ,,,An analyte assay that measures the presence or amount of antibodies to a specified antigen. ,OBI,Test performed using antibodies produced by human B-cells that bind with human immunodeficiency virus (HIV) antigens,,"Chris Stoeckert, Bjoern Peters, Randi Vita, James Overton",NCI BBRB,https://github.com/obi-ontology/obi/issues/825,subclass,,analyte assay,,,,,,,,,,,,
OBI:0002146,HIV antibody assay,,HIV I/II Ab assay,An antigen specific antibodies assay that is meant to detect antibodies that bind to human immunodeficiency virus (HIV) antigens.,OBI,,HIV-1 and HIV-2 are two different viruses (http://i-base.info/qa/36),"Chris Stoeckert, Bjoern Peters, Randi Vita, James Overton",NCI BBRB,https://github.com/obi-ontology/obi/issues/825,subclass,,antigen specific antibodies assay ,,,,('immunoglobulin complex' and ('has disposition to bind' some ('Human immunodeficiency virus 1' or 'Human immunodeficiency virus 2'))),,,,,,,,
OBI:0002147,HIV group O antibody assay,,HIV I/II Plus O assay,An antigen specific antibodies assay that is meant to detect antibodies that bind to human immunodeficiency virus (HIV) group O antigens.,OBI,,https://www.cdc.gov/mmwr/preview/mmwrhtml/00042810.htm,"Chris Stoeckert, Bjoern Peters, Randi Vita, James Overton",NCI BBRB,https://github.com/obi-ontology/obi/issues/825,subclass,,antigen specific antibodies assay ,,,,('immunoglobulin complex' and ('has disposition to bind' some ('Human immunodeficiency virus 1' or 'Human immunodeficiency virus 2' or 'HIV-1 group O'))),,,,,,,,
OBI:0002148,surface HBV antibody assay,,HBsAb assay,An antigen specific antibodies assay that is meant to detect antibodies that bind to hepatitis B virus (HBV) surface antigens.,OBI,,,"Chris Stoeckert, Bjoern Peters, Randi Vita, James Overton",NCI BBRB,https://github.com/obi-ontology/obi/issues/825,subclass,,antigen specific antibodies assay ,,,,('immunoglobulin complex' and ('has disposition to bind' some 'Hepatitis B virus')),,,,,,,,
OBI:0002149,core HBV antibody assay,,HBcAb assay,An antigen specific antibodies assay that is meant to detect antibodies that bind to hepatitis B virus (HBV) core antigens.,OBI,,,"Chris Stoeckert, Bjoern Peters, Randi Vita, James Overton",NCI BBRB,https://github.com/obi-ontology/obi/issues/825,subclass,,antigen specific antibodies assay ,,,,('immunoglobulin complex' and ('has disposition to bind' some 'Hepatitis B virus')),,,,,,,,
OBI:0002150,core HBV IgM antibody assay,,HBcAb-IgM assay,An antigen specific antibodies assay that is meant to detectimmunoglobulin M (IgM) antibodies that bind to hepatitis B virus (HBV) core antigens.,OBI,,,"Chris Stoeckert, Bjoern Peters, Randi Vita, James Overton",NCI BBRB,https://github.com/obi-ontology/obi/issues/825,subclass,,antigen specific antibodies assay ,,,,('immunoglobulin complex' and ('has disposition to bind' some 'Hepatitis B virus')),,,,,,,,
OBI:0002151,HCV antibody assay,,HCV Ab assay,An antigen specific antibodies assay that is meant to detect antibodies that bind to Hepatitis C virus (HCV) antigens.,OBI,,,"Chris Stoeckert, Bjoern Peters, Randi Vita, James Overton",NCI BBRB,https://github.com/obi-ontology/obi/issues/825,subclass,,antigen specific antibodies assay ,,,,('immunoglobulin complex' and ('has disposition to bind' some 'Hepatitis C virus')),,,,,,,,
OBI:0002152,EBV IgG antibody assay,,EBV IgG Ab assay,An antigen specific antibodies assay that is meant to detect immunoglobulin G (IgG) antibodies that bind to Epstein-Barr virus (EBV) antigens.,OBI,,,"Chris Stoeckert, Bjoern Peters, Randi Vita, James Overton",NCI BBRB,https://github.com/obi-ontology/obi/issues/825,subclass,,antigen specific antibodies assay ,,,,('immunoglobulin complex' and ('has disposition to bind' some 'Human gammaherpesvirus 4')),,,,,,,,
OBI:0002153,EBV IgM antibody assay,,EBV IgM Ab assay,An antigen specific antibodies assay that is meant to detect immunoglobulin M (IgM) antibodies that bind to Epstein-Barr virus (EBV) antigens.,OBI,,,"Chris Stoeckert, Bjoern Peters, Randi Vita, James Overton",NCI BBRB,https://github.com/obi-ontology/obi/issues/825,subclass,,antigen specific antibodies assay ,,,,('immunoglobulin complex' and ('has disposition to bind' some 'Human gammaherpesvirus 4')),,,,,,,,
OBI:0002154,CMV antibody assay,,CMV Ab assay,An antigen specific antibodies assay that is meant to detect antibodies that bind to cytomegalovirus (CMV) antigens.,OBI,,,"Chris Stoeckert, Bjoern Peters, Randi Vita, James Overton",NCI BBRB,https://github.com/obi-ontology/obi/issues/825,subclass,,antigen specific antibodies assay ,,,,('immunoglobulin complex' and ('has disposition to bind' some 'Cytomegalovirus')),,,,,,,,
OBI:0002155,venereal disease research laboratory test,,VDRL test,An analyte assay that is meant to detect general antibodies that react with substances that are produced by cellular damage caused by Treponema pallidum indicating a syphilis infection. VDRL tests require a microscope and can be done on cerebrospinal fluid as well as blood.,OBI,,,"Chris Stoeckert, Bjoern Peters, Randi Vita, James Overton",NCI BBRB,https://github.com/obi-ontology/obi/issues/825,subclass,,analyte assay,,,,'immunoglobulin complex',,,,,,,,
OBI:0002156,rapid plasma reagin test,,RPR assay,An analyte assay that is meant to detect with the aid of carbon or charcoal particles general antibodies that react with substances that are produced by cellular damage caused by Treponema pallidum indicating a syphilis infection. RPR tests can be done without a microscope.,http://www.differencebetween.net/science/health/difference-between-vdlr-and-rpr/,,,"Chris Stoeckert, Bjoern Peters, Randi Vita, James Overton",NCI BBRB,https://github.com/obi-ontology/obi/issues/825,subclass,,analyte assay,,,,'immunoglobulin complex',,,,,,,,
OBI:0002157,HBV surface antigen assay,,HBsAg assay,An analyte assay that is meant to detect hepatitis B virus (HBV) surface antigens.,OBI,,,"Chris Stoeckert, Bjoern Peters, Randi Vita, James Overton",NCI BBRB,https://github.com/obi-ontology/obi/issues/825,subclass,,analyte assay,,,,'Hepatitis B virus',,,,,,,,
OBI:0002158,HIV-1 nucleic acid testing,,HIV-1 NAT,An analyte assay that is meant to detect human immunodeficiency virus (HIV-1) nucleic acids.,OBI,,,"Chris Stoeckert, Bjoern Peters, Randi Vita, James Overton",NCI BBRB,https://github.com/obi-ontology/obi/issues/825,subclass,,analyte assay,,,,('nucleic acid' and ('part of' some 'Human immunodeficiency virus 1')),,,,,,,,
OBI:0002159,HCV nucleic acid testing,,HCV NAT,An analyte assay that is meant to detect hepatitis C virus (HCV) nucleic acids.,OBI,,,"Chris Stoeckert, Bjoern Peters, Randi Vita, James Overton",NCI BBRB,https://github.com/obi-ontology/obi/issues/825,subclass,,analyte assay,,,,('nucleic acid' and ('part of' some 'Hepatitis C virus')),,,,,,,,
OBI:0002161,systematic evolution of ligands by exponential enrichment assay,,SELEX,"A binding assay that identifies protein-binding sites on nucleic acids by selecting high-affinity target ligands from a randomized pool. The process is repeated in rounds, then the bound nucleic acids are separated from the unbound nucleic acids and amplified by PCR. ",PMID:21720957,,,Rebecca Tauber,,,subclass,,binding assay,,,,,,,,,,,,
OBI:0002162,footprinting assay,,,"An assay that measures ligand binding and conformational changes by the solvent accessibility of the backbone, bases, or side-chain structures of macromolecules through their sensitivity to chemical or enzymatic cleavage or modification reactions.",DOI: 10.1002/3527600906.mcb.200300025,,,Bjoern Peters,,,subclass,,assay,,,,,,,,,,,,
OBI:0002163,DNAse footprinting assay,,,An enzymatic footprinting assay that determines protein-binding sites on DNA by identifying bound fragments that are protected from DNAse I-catalyzed hydrolysis,OBI development call,,,Rebecca Tauber,,,subclass,,footprinting assay,,,,,,,,,,,,
OBI:0002164,mammalian 2-hybrid assay,,,"A binding assay that increases the expression of a reporter gene in mammalian cells by proteins of interest attached to two portions of the transcriptional activator, bringing those portions closer together.",PMID:9043710|ECO:0001095,,,Rebecca Tauber,,,subclass,,binding assay,,,,,,,,,,,,
OBI:0002165,protein localization assay,,,An assay that determines the specific location of a protein. Subcellular localization is distinguished from tissue-based localization based on the type of microscopy applied.,OBI development call,,,Rebecca Tauber,,,subclass,,assay,,,,,,,,,,,,
OBI:0002166,tissue-based protein localization assay,,,A protein localization assay that determines the specific location of a protein in a living tissue sample.,PMID:14686950,,,Rebecca Tauber,,,subclass,,protein localization assay,,,,,,,,,,,,
OBI:0002167,subcellular protein localization assay,,,A protein localization assay that determines the specific subcellular location of a protein. The location is visualized through electron microscopy. ,ECO,,,Rebecca Tauber,,,subclass,,protein localization assay,,,,,electron microscope,,,,,,,
OBI:0002168,subcellular protein immunohistochemistry assay,,,An immunohistochemistry assay that uses antibodies to display the specific subcellular location of proteins.,ECO,,,Rebecca Tauber,,,subclass,,immunohistochemistry,,,,,,,,,,,,
OBI:0002169,ChIP-qPCR assay,,,A ChIP assay that uses quantitative PCR to determine levels of specific DNA in immunoprecipitated samples.,PMID:18388953,,,Chris Stoeckert,,,subclass,,ChIP assay,,real time polymerase chain reaction assay,,,,,,,,,,
OBI:0002170,genomic SELEX,,,A systematic evolution of ligands by exponential enrichment assay that starts with a library derived from genomic DNA instead of synthetically derived random DNA molecules.,PMID:20541015,,,Chris Stoeckert,,,subclass,,systematic evolution of ligands by exponential enrichment assay,,,,,,,,,,,,
OBI:0002171,dot blot assay,,dot blot analysis,An analyte assay that detects molecules in a mixture dotted on a membrane using DNA probes or antibodies.,PMID:10473518,,,Bjoern Peters,,,subclass,,analyte assay,,,,,,,,,,,,
OBI:0002172,Northwestern blot assay,,Northwestern assay|Northwestern analysis,A direct binding assay that detects interactions of labeled RNA with immobilized protein on a membrane.,PMID:26965261,,,Bjoern Peters,,,subclass,,direct binding assay,,,,,,,,,,,,
